{
  "surface": "idea-session-capture",
  "schema_version": "1.0",
  "created_at": "2026-05-18T01:46:53+00:00",
  "updated_at": "2026-05-18T02:34:17+00:00",
  "project": {
    "title": "The Unfinished Shadow",
    "franchise": "Star Wars (Legends EU)",
    "book_slug": "the-unfinished-shadow",
    "franchise_slug": "star-wars-legends-eu",
    "session_name": "ben-skywalker-book-1-foundation"
  },
  "relationship": {
    "project_scope": "planned_series",
    "canon_status": "AU",
    "series_id": null,
    "book_number": 1,
    "cosmology_id": null,
    "source_franchise": "Star Wars Legends Expanded Universe",
    "source_work": null,
    "parent_project": null,
    "branch_point": "Post-Fate of the Jedi (47 ABY). Legacy comics did not happen. The One Sith on Korriban remain in pre-emergence under Darth Krayt.",
    "base_source": null
  },
  "source": {
    "transcript_path": null,
    "raw_transcript_file": null
  },
  "north_star": {
    "one_sentence_pitch": "Ben Skywalker, three years after Fate of the Jedi and quietly hungry for meaningful work, is pulled into a post-war conspiracy around a duplicated wartime shipment manifest his cousin Jacen Solo personally encrypted before his death — and forced to discover that the GAG-era lessons Jacen left inside him still work, even when saving lives requires using them.",
    "reader_promise": "A post-Fate of the Jedi Legends conspiracy thriller written to commercial-novel quality: murder, clue, prison break, uneasy partnership, archive attack, respected charity with a hidden inner ring, offworld Force-site climax, rescue, duel, and a morally dangerous ending. Ben as protagonist; Talon Veyr as wounded rogue partner; Aevyn Soris as Ben's true mirror — the other student of Jacen, the side project who lived in the gaps.",
    "emotional_core": "Can Ben face what Jacen left inside him without becoming another unfinished piece of Jacen's legacy?",
    "author_intent": "Reader pleasure before theme. The reader should finish remembering a tense Star Wars adventure with Ben Skywalker, a great rogue partner, a creepy Jacen legacy mystery, an offworld Force-site climax, and a morally dangerous ending. Only afterward should the deeper themes — restraint can cost lives, Jacen's crisis logic can save lives, forbidden knowledge may be necessary to heal or protect people — fully settle in. Ben's danger is not that he wants to become Jacen; it is that he wants to make sure Jacen was not meaningless.",
    "non_negotiables": [
      "Post-Fate of the Jedi Legends continuity; Legacy comics did not happen.",
      "Brooks Story Engineering as loose architectural overlay across 38 chapters; milestones LOCKED to chapter numbers in Chapter Outlines v4.0.",
      "Hook (Ch 1) is one sustained Elya Rane chapter through her death; Aevyn frightens before he is understood.",
      "First Plot Point (Ch 9, ~24%) is the storm-line prison escape — forced partnership with Talon is the door Ben cannot return through.",
      "Midpoint (Ch 16) carries Iressa's two-part dying transmission (documentary chain + identity-shaping revelation) and Ben's pivot from investigator to active disruptor after holo calls to Luke and Saba.",
      "PP2 (Ch 20) is the three-part Squeeze: Tess clears Korda, the cache is raided/burned, Talon is framed with Tess's tradecraft fingerprint, and the Iresh acceleration closes every door except going off-grid.",
      "Climax (Ch 31-32) is rescue first, duel second; the Glasswell sequence saves Tavi and locals BEFORE the Ben/Aevyn lightsaber duel.",
      "Ben preserves the unfinished holocron; his answer to Luke in Ch 36 is technically true and morally incomplete. Luke senses it and does not force the answer.",
      "Final image (Ch 38): cold white-blue spark in the dark below the broken Glasswell — Aevyn survived.",
      "Jedi Order HQ is Shedu Maad (Hapes Cluster); Saba Sebatyne is Grand Master; Luke is senior Master, stepped back, post-Crucible quieter. Coruscant has no Jedi institutional footing.",
      "The Vigil/Foundation is hard to attack because the Foundation's public charitable work is REAL; Aelia's warmth is real.",
      "Iresh is a place before it is a metaphor; it preserves charged impressions, it does not reveal truth or prophecy.",
      "Investigation reader-facing vocabulary: fragment, duplicate manifest, quarantine disguise, archive, Foundation link, Iresh manifest/authorization. NO procedural jargon stacks.",
      "Iressa dies with agency, denying the enemy a clean copy; her death is not reducible to a lesson for Ben.",
      "Ben's holocron omission BEGINS in Act Three (Ch 33-34), not just in the coda."
    ],
    "avoid": [
      "Vestara Khai as active participant (mention only — Vara's archive scar-tissue line).",
      "Tahiri Veila on-page (single passing reference allowed if natural; no Caedus mention).",
      "Han and Leia as active participants (mention only; effectively retired post-Crucible).",
      "Allana / Amelia as POV or active participant (hidden engine, future danger).",
      "Jaina Solo as active participant (deliberately excluded — bringing her in would be using her grief).",
      "Full reveal of Darth Krayt / the One Sith — the hand is glimpsed or implied only.",
      "Galactic war — this is a postwar investigation, not a war story.",
      "Full Dorvan brainwashing — Dorvan is a FUTURE target, not an already-compromised puppet.",
      "Major cloning plot — Crosscurrent/Riptide connective tissue stays background only.",
      "Mortis monolith / Father-Son-Daughter mythology as plot — Crucible aftermath is Luke's unspoken texture, not on-page.",
      "Imitating any specific published Star Wars author's prose; use broad franchise feel only.",
      "Lines that sound wiser, cooler, or more poetic than the character would naturally be.",
      "Theme announced as thesis statement in prose or dialogue. Theme is shown through behavior, pressure, cost, consequence.",
      "More than one invented bureaucratic/technical term per paragraph in Act 2; every technical phrase translated to human stakes within two sentences.",
      "Ben repeatedly asking himself 'Am I becoming Jacen?'. Stronger: other characters react to him before he fully admits what they saw."
    ]
  },
  "depth_ladder": [
    {
      "stage": "spark",
      "goal": "Find the idea, promise, and emotional pressure.",
      "status": "open"
    },
    {
      "stage": "foundation",
      "goal": "Set universe, continuity, tone, premise, conflict, and theme.",
      "status": "open"
    },
    {
      "stage": "deepening",
      "goal": "Develop characters, setting logic, voice, structure, and recurring choices.",
      "status": "open"
    },
    {
      "stage": "production_handoff",
      "goal": "Turn settled decisions into six workflow-kit surfaces.",
      "status": "open"
    }
  ],
  "decisions": [
    {
      "surface": "universe",
      "topic": "Era and setting anchor",
      "decision": "~47 ABY, roughly three years after the close of Fate of the Jedi. Coruscant anchors Acts 1-2; Iresh (remote wind-scoured world) anchors Act 3; coda returns to Coruscant / Shedu Maad.",
      "confidence": "settled"
    },
    {
      "surface": "universe",
      "topic": "Genre and shape",
      "decision": "Conspiracy thriller with Star Wars mythic/Force climax. NOT a galactic-war story; a morally tense postwar investigation into the afterlife of Jacen/Caedus, GAG, and dangerous knowledge.",
      "confidence": "settled"
    },
    {
      "surface": "universe",
      "topic": "Target shape",
      "decision": "Standalone-but-series-capable. 38 chapters. Commercial-novel quality of storytelling and prose. Fanfiction, non-commercial.",
      "confidence": "settled"
    },
    {
      "surface": "universe",
      "topic": "Galactic state",
      "decision": "Dorvan administration in return-to-normalcy mode. Jedi based at Shedu Maad (Hapes). Jagged Fel still Imperial Remnant head of state; Tenel Ka still Queen Mother of Hapes. The Dorvan administration has restored procedure, not trust.",
      "confidence": "settled"
    },
    {
      "surface": "canon",
      "topic": "Continuity stance",
      "decision": "Post-FOTJ Legends continues normally. Crucible (45 ABY) is canon; Luke/Leia/Han are post-Mortis-encounter and effectively retired. Legacy comics did NOT happen. The One Sith on Korriban exist and remain in patient pre-emergence under Darth Krayt.",
      "confidence": "settled"
    },
    {
      "surface": "canon",
      "topic": "Force mechanics — Iresh and the Glasswell",
      "decision": "Iresh preserves impressions of identity, memory, and decision under pressure. It does NOT show the future, reveal truth, or grant prophecy. The Glasswell is a natural site (mirror-lake / sinkhole / pale translucent mineral) Jacen exploited for practical concealment — not a Sith temple, Jedi ruin, or mystical treasure chamber.",
      "confidence": "settled"
    },
    {
      "surface": "canon",
      "topic": "Force mechanics — the unfinished holocron",
      "decision": "Unfinished working holocron assembled during LotF period from Jacen's Force-odyssey notes, Vergerean thought, Lumiya's Sith inheritance, GAG-era observations, and Jacen's private systematization of Recognition, Deepening, and Holding. Part notebook, part training device, part confession, part contingency, part laboratory.",
      "confidence": "settled"
    },
    {
      "surface": "canon",
      "topic": "Jedi Order institutional state",
      "decision": "Jedi Order HQ relocated permanently to Shedu Maad (Hapes Cluster) at end of FOTJ (44 ABY). Saba Sebatyne is Grand Master. Luke is senior Master on the Council, stepped back after Crucible. Coruscant Jedi Temple is no longer Order property. Luke can advise but not convene; escalation runs through Saba.",
      "confidence": "settled"
    },
    {
      "surface": "canon",
      "topic": "Investigation vocabulary rule",